id,title,announcementTitle,shortAnnouncementTitle,status,type,accessType,endAt,startAt,division/id,division/name,division/lat,division/lng,tags/0/name,tags/1/name,merchant/id,merchant/name,merchant/websiteUrl,options/0/expiresInDays,options/0/redemptionLocations/0/name,options/0/redemptionLocations/0/streetAddress1,options/0/redemptionLocations/0/streetAddress2,options/0/redemptionLocations/0/state,options/0/redemptionLocations/0/city,options/0/redemptionLocations/0/neighborhood,options/0/redemptionLocations/0/postalCode,options/0/redemptionLocations/0/country
pacific-scuba-divers,Full NASE Certification Scuba Diving Course for One or Two at Pacific Scuba Divers (Up to 85% Off) ,Up to 85% Off Scuba Diving Course for at Pacific Scuba Divers,Scuba Diving Courses,open,groupon,extended,2041-06-13T06:59:59Z,2017-02-07T08:00:00Z,san-jose,San Jose,37.3394,-121.895,SCUBA Certification,Courses - Continuing Education,pacific-scuba-divers-1,Pacific Scuba Divers,http://www.pacificscubadivers.com/,120,Pacific Scuba Divers,1179 East Homestead Road,,CA,Sunnyvale,Birdland,94087,US
san-jose-state-volleyball-camps-1,Volleyball Camps at San Jose State Volleyball Camps (Up to 48% Off). Multiple Dates Available.,"Up to 48% Off at San Jose State Volleyball Camps
",Volleyball Camps,open,groupon,extended,2017-08-05T06:59:59Z,2017-03-11T08:00:00Z,san-jose,San Jose,37.3394,-121.895,Camp,Camp - Sport,san-jose-state-volleyball-camps,San Jose State Volleyball Camps,http://www.sjsuspartans.com/,,Central San Jose,1393 South 7th Street,,CA,San Jose,Central San Jose,95112,US
gl-bubble-run-10,"Bubble Run 5K on Saturday, June 10, at 8 a.m.",Bubble Run – Up to 60% Off 5K,Bubble Run 5K,open,groupon,extended,2017-06-09T06:59:59Z,2017-03-03T08:00:00Z,san-jose,San Jose,37.3394,-121.895,Races & Runs,Race - Color (Activity / Experience),blacklight-run-3,Bubble Run,http://bubblerun.com/upcoming-locations/san-jose-ca-2017/,,Santa Clara County Fairgrounds,344 Tully Rd,,CA,San Jose,South San Jose,95111,US
mother-lode-river-center-9,Weekday or Weekend Chili Bar Rafting Trip & Gold Rush Tour with Mother Lode River Center (Up to 48% Off),Up to 48% Off Rafting Trips,Rafting Trips,open,groupon,extended,2017-08-20T06:59:59Z,2016-11-18T08:00:00Z,fresno,Fresno,36.7477,-119.772,Watersports,White Water Rafting (Ride / Activity),mother-lode-river-center-2,Mother Lode River Center,http://www.malode.com/,,Lotus,6280 Golden Chain Highway,,CA,Lotus,Tamaroo Ridge,95651,US
tgif-farms-1,"One, Two, or Four 60-Minute Horseback-Riding Lessons at TGIF Farms (Up to 58% Off)",Up to 58% Off Horseback Riding at TGIF Farms,Horseback-Riding Lessons,open,groupon,extended,2041-06-09T06:59:59Z,2017-02-03T08:00:00Z,fresno,Fresno,36.7477,-119.772,Horse Back Riding - Recreational,Rides,tgif-farms,TGIF Farms,http://www.tgiffarms.com,120,Milipitas,80 Evans Road,,CA,Milipitas,Sunnyhills,95035,US
rooster-t-feathers-comedy-club-4-8,Standup Comedy at Rooster T. Feathers Comedy Club (Up to 64% Off),Up to 64% Off Standup Comedy,Standup Comedy,open,groupon,extended,2040-02-07T07:59:59Z,2015-10-01T07:00:00Z,san-jose,San Jose,37.3394,-121.895,Comedy,Stand-up Show,rooster-t-feathers-comedy-club,Rooster T. Feathers Comedy Club,http://www.roostertfeathers.com,180,Rooster T. Feathers Comedy Club,157 W El Camino Real,,CA,Sunnyvale,,94087,US
gilroy-golf-course,"Golf with Cart, Range Balls, and Beer at Gilroy Golf Course (Up to 49% Off). Four Options Available.",Up to 49% Off at Gilroy Golf Course,Golf with Cart and Range Balls,open,groupon,extended,2041-01-23T07:59:59Z,2016-09-16T07:00:00Z,san-jose,San Jose,37.3394,-121.895,Sports & Related,Golf - Recreational,gilroy-golf-course,Gilroy Golf Course,http://www.gilroygolfcourse.com/index.htm,120,Gilroy,2695 Hecker Pass Rd,,CA,Gilroy,Coyote,95020,US
skydiving-san-francisco-4,$119 for One Tandem Jump at Skydiving San Francisco ($269.99 Value),56% Off Tandem Skydive,Tandem Skydive,open,groupon,extended,2017-12-03T05:59:59Z,2016-07-12T05:00:00Z,modesto,Modesto,37.6391,-120.997,Flying,Parachuting / Skydiving - Tandem (Ride / Experience),skydiving-san-francisco,Skydiving San Francisco,http://www.skydiving-sanfrancisco.com/,,,,,,,,,
poppy-hills-golf-course-1-5,"Rounds of Golf in Pebble Beach, CA at Poppy Hills Golf Course (Up to 56% Off) ",Up to 56% Off at Poppy Hills Golf Course,"Golf in Pebble Beach, CA",open,groupon,extended,2017-06-01T06:59:59Z,2017-02-22T08:00:00Z,fresno,Fresno,36.7477,-119.772,Sports & Related,Golf - Recreational,poppy-hills-golf-course,Poppy Hills Golf Course,http://www.poppyhillsgolf.com/,,Pebble Beach,3200 Lopez Rd.,,CA,Pebble Beach,Skyline Forest,93953,US
safesplash-swim-school-24-san-francisco,"Swim-Class Packages for One, Two, Three, or Four Students at SafeSplash Swim School (Up to 69% Off).",Up to 69% Off Swim-Class Packages at SafeSplash Swim School ,Swim Class Packages ,open,groupon,extended,2041-03-15T06:59:59Z,2016-11-09T08:00:00Z,napa-sonoma,Napa / Sonoma,38.4405,-122.714,Swimming - Training,Courses - Sports Training,safe-splash-swim-school-8,SafeSplash Swim School,https://www.safesplash.com/,120,San Jose  - Newhall,610 Newhall Dr,A,CA,San Jose-Newhall,North San Jose,95110,US
left-coast-tours-5,City Tour for Two with Optional Muir Woods Tour from Left Coast Tours (Up to 51% Off) ,Up to 51% Off City Tour and Muir Woods Tour ,Left Coast Tours,open,groupon,extended,2040-10-12T06:59:59Z,2016-06-08T07:00:00Z,san-jose,San Jose,37.3394,-121.895,Tour - City,Tour,left-coast-tours,Left Coast Tours,http://www.leftcoasttoursf.com,150,Left Coast Tours,5th and Market St,Suite 4225,CA,San Francisco,Yerba Buena,94104,US
ultra-music-studio-1,"4 Hours of Karaoke for Six, 10, 15, 20, or 30 People at Ultra Music Studio (Up to 60% Off)",Up to 60% Off 4 Hours of Karaoke at Ultra Music Studio,Karaoke,open,groupon,extended,2041-07-03T07:00:00Z,2017-03-03T08:00:00Z,san-francisco,San Francisco,37.7752,-122.419,Caf̩e / Bar Offerings,Karaoke Bar,ultra-music-studio,Ultra Music Studio,https://www.yelp.com/biz/ultra-music-studio-fremont,120,Fremont,34771 Ardenwood Boulevard,,CA,Fremont,Ardenwood,94555,US
3-steves-winery,"Wine Tasting for Two, Four, or Six at 3 Steves Winery (Up to 62% Off)",Up to 62% Off Wine Tasting at 3 Steves Winery,Wine Tasting,open,groupon,extended,2041-05-19T06:59:59Z,2017-01-13T08:00:00Z,san-francisco,San Francisco,37.7752,-122.419,Restaurant Specialty - Wine Tasting / Flight,Tastings,3-steves-winery-1,3 Steves Winery,http://www.3steveswinery.com,120,The Vineyards,5700 Greenville Road,,CA,Livermore,The Vineyards,94550,US
peninsula-gymnastics,$39 for Four Weekly Beginners' Gymnastics Classes for One Child at Peninsula Gymnastics ($126 Value),69% Off Beginners' Gymnastics Classes,Beginners' Gymnastics Classes,open,groupon,extended,2040-06-24T06:59:59Z,2016-02-19T08:00:00Z,san-francisco,San Francisco,37.7752,-122.419,Gymnastics (Activity / Experience),Sports & Related,peninsula-gymnastics,Peninsula Gymnastics,http://www.peninsulagym.com,120,San Mateo,1740 Leslie Street,,CA,San Mateo,Hayward Park,94402,US
goldstar-american-improv-theatre,"""Jeff &amp; Friends""","""Jeff &amp; Friends""",American Improv Theatre,open,groupon,featured,2017-05-28T03:00:00Z,2017-02-06T22:48:58Z,san-jose,San Jose,37.3394,-121.895,Comedy,Improv Show,goldstar,American Improv Theatre,http://www.americanimprovtheatre.com/,,Black Cat Licorice Theater,260 McEvoy St.,,CA,San Jose,Sunol-Midtown,95050,US
enjoy-napa-valley,Napa River Kayak Tour for Two or Four or a Kayak Rental for Two from Enjoy Napa Valley (51% Off),51% Off Kayak Tour from Enjoy Napa Valley,Kayak Tour or Rental,open,groupon,extended,2039-04-01T06:59:59Z,2014-11-26T08:00:00Z,napa-sonoma,Napa / Sonoma,38.4405,-122.714,Tour - Guided,Tour,enjoy-napa-valley,Enjoy Napa Valley,http://www.enjoy-napa-valley.com/,111,Cental Napa,100 Riverside Drive,,CA,Napa,Cental Napa,94559,US
dance-boulevard-1,"Weekly Series of 4, 8, or 12 Level 1 Group Dance Classes at Dance Boulevard (55% Off)",55% Off Dance Lessons at Dance Boulevard,Group Dance Lessons,open,groupon,extended,2038-07-06T06:59:59Z,2014-03-05T08:00:00Z,san-jose,San Jose,37.3394,-121.895,Dance Class,Courses - Sports Training,dance-boulevard,Dance Boulevard,http://www.sjdancesport.com/,120,Rose - Sartorette,1824 Hillsdale Ave.,,CA,San Jose,Rose - Sartorette,95124,US
derose-winery-4,Wine Tasting at DeRose Winery (Up to 70% Off),Up to 70% Off Wine Tasting at DeRose Winery,Wine Tasting at DeRose Winery,open,groupon,extended,2041-07-07T06:59:59Z,2017-03-03T08:00:00Z,san-jose,San Jose,37.3394,-121.895,Restaurant Specialty - Wine Tasting / Flight,Tastings,derose-winery,DeRose Winery,http://www.derosewine.com/,90,Downtown Salinas,9970 Cienega Rd,,CA,Hollister,Downtown Salinas,95023,US
west-coast-training-center-3,Three Open Gyms for One or Two Children at WestCoast Training Center (Up to 63% Off),Up to 63% Off Open Gym at WestCoast Training Center,Open Gym,open,groupon,extended,2041-05-20T06:59:59Z,2017-01-17T08:00:00Z,san-francisco,San Francisco,37.7752,-122.419,Gymnastics (Activity / Experience),Sports & Related,west-coast-training-center-1,WestCoast Training Center,http://www.westcoasttc.com/,120,WestCoast Training Center,50 Wright Brothers Ave,,CA,Livermore,Isabel,94551,US
half-moon-bay-kayak-company-4-san-jose,$32 for a 1-Hour Paddleboard or Single- or Double-Kayak Rental for 2 from Half Moon Bay Kayak ($65 Value),51% Off Kayak or Paddleboard Rental,Kayak or Paddleboard Rental,open,groupon,extended,2039-02-20T07:59:59Z,2014-10-17T07:00:00Z,san-jose,San Jose,37.3394,-121.895,Kayak Rental,Boat Rental,half-moon-bay-kayak-company,Half Moon Bay Kayak Co.,http://www.hmbkayak.com/,90,El Granada,2 Johnson Pier,,CA,Half Moon Bay,El Granada,94019,US
j-lohr-vineyards-wines-1,"Friday Wine and Cheese Tasting for Two, Four, or Six at J. Lohr Vineyards & Wines (Up to 44% Off) ",Up to 44% Off Friday Wine and Cheese Tasting ,Wine and Cheese Tasting,open,groupon,extended,2039-05-16T06:59:59Z,2015-01-10T08:00:00Z,san-jose,San Jose,37.3394,-121.895,Restaurant Specialty - Wine Tasting / Flight,Tastings,j-lohr-vineyards-wines,J. Lohr Vineyards & Wines,http://www.jlohr.com/,120,Shasta-Hanchett,1000 Lenzen Ave,,CA,San Jose,Garden Alameda,95126,US
paintball-international-19,$49 for an All-Day Paintball Party with Equipment for Up to 10 at Paintball International ($350 Off),86% Off All-Day Paintball for Up to 10,All-Day Paintball for Up to 10,open,groupon,extended,2038-04-23T07:59:59Z,2013-12-18T08:00:00Z,san-jose,San Jose,37.3394,-121.895,Shooting,Paintball (Activity / Experience),pn-l-paintball,Paintball International,http://www.paintballtickets.com/,30,Santa Clara Paintball,2542 Monterey Rd,,CA,San Jose,South San Jose,95111,US
partipalooza,"10, 15, or 20 Kids' Drop-In Play Sessions at PartiPalooza (Up to 58% Off)",Up to 58% Off Kids' Indoor Play Sessions,Kids' Indoor Play Sessions,open,groupon,extended,2040-06-25T06:59:59Z,2016-02-20T08:00:00Z,san-francisco,San Francisco,37.7752,-122.419,Indoor Play Area,Jumping,parti-palooza,PartiPalooza,http://www.partipalooza.com,90,Livermore,6253 Southfront Rd.,,CA,Livermore,Livermore,94551,US
bay-area-glass-institute-9,"Bowl- or Bead-Making Class for One, or Glass-Fusing Experience for 2 at Bay Area Glass Institute (Up to 56% Off) ",Up to 56% Off Classes at Bay Area Glass Institute,Glass Classes,open,groupon,extended,2039-01-10T07:59:59Z,2014-09-06T07:00:00Z,san-jose,San Jose,37.3394,-121.895,Courses - Entertainment Media / Arts,Glassblowing & Stained Glass Class,bay-area-glass-institute,Bay Area Glass Institute,http://www.bagi.org,90,Bay Area Glass Institute,635 Phelan Avenue,,CA,San Jose,Rockspring,95112,US
the-murder-mystery-co-8-san-jose,Murder-Mystery Dinner for One or Two at The Murder Mystery Co. (Up to 55% Off),Up to 55% Off at The Murder Mystery Co.,Murder-Mystery Dinner,open,groupon,extended,2040-02-16T07:59:59Z,2015-10-13T07:00:00Z,san-jose,San Jose,37.3394,-121.895,Experiential Dining,Dinner - Murder Mystery,the-murder-mystery-co,The Murder Mystery Co.,http://murdermysterydinnersanjose.com/,180,,,,,,,,
skydive-monterey-bay-1,"Weekday or Weekend VIP Tandem Jump for One, Two, or Four at Skydive Monterey Bay (Up to 39% Off)",Up to 39% Off VIP Jump at Skydive Monterey Bay,VIP Tandem Jump,open,groupon,extended,2039-02-26T07:59:59Z,2014-10-23T07:00:00Z,san-jose,San Jose,37.3394,-121.895,Flying,Parachuting / Skydiving - Tandem (Ride / Experience),skydive-monterey-bay,Skydive Monterey Bay,http://www.skydivemontereybay.com/,180,Marina,721 Neeson Rd.,Suite 1,CA,Marina,Marina,93933,US
redwood-coast-cider-1,Two or Four Tasting Flights at Redwood Coast Cider (Up to 55% Off) ,55% Off Tasting Flights at Redwood Coast Cider,Tasting Flights ,open,groupon,extended,2041-02-17T07:59:59Z,2016-10-14T07:00:00Z,san-francisco,San Francisco,37.7752,-122.419,Tasting - Other,Tastings,redwood-coast-cider,Redwood Coast Cider,http://redwoodcoastcider.com,120,Clearfield Park,821 Cherry Ln,,CA,San Carlos,Clearfield Park,94070,US
image-light-photography-4,One Digital Camera Advanced Basics Class for One or Two at Image Light Photography (Up to 61% Off),Up to 61% Off Digital Camera Classes,Digital Camera Classes,open,groupon,extended,2041-03-27T06:59:59Z,2016-11-21T08:00:00Z,san-francisco,San Francisco,37.7752,-122.419,Courses - Entertainment Media / Arts,Photography Class,image-light-photography,Image Light Photography,http://www.imagelight.com,120,Image Light Photography,"39 California Ave, Suite 107",,CA,Pleasanton,Asco - Radum,94566,US
nor-cal-hobbies-raceway,RC Truck Rental for Two at Nor-Cal Hobbies (40% Off),40% Off RC Truck Rental for Two,RC Truck Rental for Two,open,groupon,extended,2041-04-20T06:59:59Z,2016-12-15T08:00:00Z,san-jose,San Jose,37.3394,-121.895,Gaming,Slot Car Racing,nor-cal-hobbies-raceway,Nor-Cal Hobbies,http://www.norcalhobbies.com,120,South San Jose,2099 S 10th St,,CA,San Jose,South San Jose,95112,US
goldstar-tommy-ts-comedy-pleasanton-5,"Comedian Craig ""The Lovemaster"" Shoemaker - Friday May 5, 2017 / 7:30pm","Comedian Craig ""The Lovemaster"" Shoemaker - Friday May 5, 2017 / 7:...",Tommy T's Comedy Pleasanton,open,groupon,featured,2017-05-06T02:30:00Z,2012-05-17T00:20:15Z,san-francisco,San Francisco,37.7752,-122.419,Comedy,Stand-up Show,goldstar,Tommy T's Comedy Pleasanton,http://www.tommyts.com/,,Val Vista,5104 Hopyard Road,,CA,Pleasanton,Val Vista,94588,US
xcapade,"Room-Escape Game for Two, Four, Six, or Eight at Xcapade Entertainment (Up to 45% Off)  ",Up to 45% Off Room-Escape Game at Xcapade,Room-Escape Game,open,groupon,extended,2040-03-03T07:59:59Z,2015-10-29T07:00:00Z,san-francisco,San Francisco,37.7752,-122.419,Gaming,Room Escape Game,xcapade,Xcapade,http://www.xcapade.co/,360,Hayward,1019 B Street,,CA,Hayward,Downtown Hayward,94541,US
dennis-mitchell-golf,One-Hour Golf Lesson for One or Two at Dennis Mitchell Golf (Up to 58% Off),Up to 58% Off Golf Lesson,Golf Lesson,open,groupon,extended,2038-04-11T07:59:59Z,2013-12-06T08:00:00Z,san-francisco,San Francisco,37.7752,-122.419,Golf - Training,Courses - Sports Training,dennis-mitchell-golf,Dennis Mitchell Golf,http://www.burlingamegolfcenter.com,180,Burlingame,250 Anza Boulevard,,CA,Burlingame,Burlingame,94010,US
vino-artist-1,"Painting Class with Complimentary Wine and Snacks for One, Two, or Four at Vino Artist (Up to 57% Off)",Up to 57% Off Painting Class with Free Wine & Snacks,Art Class with Wine and Snacks,open,groupon,extended,2039-04-24T06:59:59Z,2014-12-19T08:00:00Z,san-jose,San Jose,37.3394,-121.895,Courses - Entertainment Media / Arts,Painting Lesson,vino-artist,Vino Artist,http://www.vinoartist.com,120,Santa Clara,3777 Stevens Creek Blvd,,CA,Santa Clara,Santa Clara,95051,US
aperture-academy-5,Intro to Photography at Aperture Academy (Up to 59% Off)  ,Up to 59% Off Photography Class  ,Photography Class,open,groupon,extended,2037-09-14T06:59:59Z,2013-05-10T07:00:00Z,san-jose,San Jose,37.3394,-121.895,Courses - Entertainment Media / Arts,Photography Class,aperture-academy,Aperture Academy,http://www.apertureacademy.com/,90,North San Jose,2290 N. 1st St,Suite 102,CA,San Jose,North San Jose,95131,US
san-jose-batting-cages-5,Batting Cage Practice with Optional Lesson at San Jose Batting Cages (Up to 67% Off). Four Options Available. ,Up to 67% Off at San Jose Batting Cages,Batting Cage Practice ,open,groupon,extended,2040-05-18T06:59:59Z,2016-01-13T08:00:00Z,san-jose,San Jose,37.3394,-121.895,Sports & Related,Batting Cages (Activity / Experience),san-jose-batting-cages,San Jose Batting Cages,http://www.sjbattingcages.com/,120,South San Jose,474 Piercy Rd,,CA,San Jose,Edenvale,95138,US
umigo-indoor-kart-racing-6,Weekday Race Sessions for One or Two at Umigo Indoor Go-Kart Racing (Up to 51% Off) ,Up to 51% Off at Umigo Indoor Kart Racing,Indoor Go-Karting Packages,open,groupon,extended,2041-06-18T06:59:59Z,2017-02-12T08:00:00Z,san-francisco,San Francisco,37.7752,-122.419,Karting,Go-Kart Racing (Ride / Experience),umigo-indoor-kart-racing,Umigo Indoor Kart Racing,http://www.umigoracing.com/Pages/default.aspx,90,Livermore,6538 Patterson Pass Rd.,,CA,Livermore,Ulmar,94550,US
adventure-hunt-19,"Registration For Two People to Adventure Hunt Sacramento, San Jose, or Fresno On May 20, 2017 (Up to 50% Off)",Up to 50% Off admission to Adventure Hunt,Adventure Hunt,open,groupon,extended,2017-05-20T07:00:00Z,2017-02-22T08:00:00Z,fresno,Fresno,36.7477,-119.772,Tour,Scavenger Hunt Tour / Activity,adventure-hunt,Adventure Hunt,https://adventurehunt.co/,,,,,,,,,
rancho-del-pueblo-golf-course,9-Hole Round of Golf for One or Two with Range Balls at Rancho del Pueblo Golf Course (Up to 44% Off) ,Up to 44% Off at Rancho del Pueblo Golf Course,Rancho del Pueblo Golf Course,open,groupon,extended,2038-10-13T06:59:59Z,2014-06-09T07:00:00Z,san-jose,San Jose,37.3394,-121.895,Sports & Related,Golf - Recreational,rancho-del-pueblo-golf-course,Rancho del Pueblo Golf Course,http://www.ranchodelpueblo.com/,90,Thunderbird,1649 Hermocilla Way,,CA,San Jose,Thunderbird,95116,US
cpaa-arts-center-1,Group or Private Ballroom Dancing Classes at Chinese Performing Arts of America (Up to 70% Off). Three Options.,Up to 70% Off Ballroom Dancing Classes,Ballroom Dancing Classes,open,groupon,extended,2041-03-30T06:59:59Z,2016-11-24T08:00:00Z,san-jose,San Jose,37.3394,-121.895,Dance Class,Courses - Sports Training,cpaa-arts-center,Chinese Performing Arts of America,http://www.cpaasv.org/,120,Joaquin Miller,6148 Bollinger Road,,CA,San Jose,Joaquin Miller,95129,US
sonoma-valley-balloons-18,$179 for a Hot Air Balloon Ride with Champagne Toast from Sonoma Valley Balloons ($360 Value),Half Off Hot Air Balloon Ride with Champagne Toast,Hot Air Balloon Ride,open,groupon,extended,2037-07-26T06:59:59Z,2013-03-21T07:00:00Z,san-jose,San Jose,37.3394,-121.895,Flying,Hot Air Balloon (Ride / Experience),sonoma-valley-balloons,Sonoma Valley Balloons,http://sonomavalleyballoons.com/SonomaValleyBalloons.com/Welcome.html,120,Santa Rosa,269 Aviation Blvd.,,CA,Santa Rosa,Santa Rosa,95403,US
gl-cobb-s-monthly-local-comedian-showcase-1,"Cobb's Monthly ""Local Comedian"" Showcase for Two at Cobb's Comedy Club (Up to 67% Off)   ","Cobb's Monthly ""Local Comedian"" Showcase – Up to 67% Off  ","Local Comedy Showcase	",open,groupon,extended,2017-10-02T06:59:59Z,2016-11-05T07:00:00Z,san-francisco,San Francisco,37.7752,-122.419,Comedy,Stand-up Show,cobbs-comedy-club,"Cobb's Monthly ""Local Comedian"" Showcase",http://www.cobbscomedy.com,,Cobb's Comedy Club,915 Columbus Ave.,,CA,San Francisco,Russian Hill,94133,US
101-surf-sports,Kayaking or Paddleboarding for Two at 101 Surf Sports (55% Off),55% Off Kayak or Paddleboard Rental,Kayaking or Paddleboarding,open,groupon,extended,2039-02-15T07:59:59Z,2014-10-12T07:00:00Z,san-francisco,San Francisco,37.7752,-122.419,Watersports,Kayaking - Recreational,101-surf-sports,101 Surf Sports,http://www.101surfsports.com/,90,101 Surf Sports,115 3rd Street,,CA,San Rafael,,94901,US
goldstar-made-up-theatre-9,"""Friday Night: After Hours""","""Friday Night: After Hours""",Made Up Theatre,open,groupon,featured,2017-05-06T05:00:00Z,2017-02-06T19:55:06Z,san-francisco,San Francisco,37.7752,-122.419,Comedy,Improv Show,goldstar,Made Up Theatre,http://www.MadeUpTheatre.com,,Fremont,3392 Seldon Ct.,,CA,Fremont,Grimmer,94539,US
ridgemark-golf-and-country-club,$29 for Round of Golf with Cart at Ridgemark Golf Club and Resort ($59 Value),$30 Off at Ridgemark Golf Club and Resort,Round of Golf with Cart,open,groupon,extended,2041-06-18T06:59:59Z,2017-02-12T08:00:00Z,san-jose,San Jose,37.3394,-121.895,Sports & Related,Golf - Recreational,ridgemark-golf-and-country-club-1,Ridgemark Golf Club and Resort,http://www.ridgemarkgolfclub.com/,360,Downtown Salinas,3800 Airline Highway,,CA,Hollister,Downtown Salinas,95023,US
fanxchange-san-jose-sharks,San Jose Sharks,San Jose Sharks,San Jose Sharks,open,groupon,featured,2017-05-28T10:30:00Z,2016-06-02T09:02:30Z,san-jose,San Jose,37.3394,-121.895,Sports,Hockey Game,fanxchange,San Jose Sharks ,,,Central San Jose,525 West Santa Clara Street,SAP Center,CA,San Jose,Central San Jose,95113,US
wine-country-balloons-1,$172 for a Hot Air Balloon Flight for One with Champagne Toast from Wine Country Balloons ($235 Value),27% Off Balloon Flight with Champagne,Balloon Flight with Champagne,open,groupon,extended,2038-10-03T06:59:59Z,2014-05-30T07:00:00Z,san-jose,San Jose,37.3394,-121.895,Flying,Hot Air Balloon (Ride / Experience),wine-country-balloons,Wine Country Balloons,http://balloontours.com,120,Santa Rosa,397 Aviation Blvd.,,CA,Santa Rosa,Santa Rosa,95403,US
