id,title,announcementTitle,shortAnnouncementTitle,status,type,accessType,endAt,startAt,division/id,division/name,division/lat,division/lng,tags/0/name,tags/1/name,merchant/id,merchant/name,merchant/websiteUrl,options/0/expiresInDays,options/0/redemptionLocations/0/name,options/0/redemptionLocations/0/streetAddress1,options/0/redemptionLocations/0/streetAddress2,options/0/redemptionLocations/0/state,options/0/redemptionLocations/0/city,options/0/redemptionLocations/0/neighborhood,options/0/redemptionLocations/0/postalCode,options/0/redemptionLocations/0/country
gl-california-s-great-america,$34.50 for Admission for One to California's Great America ($69 Value) ,50% Off at California's Great America,Theme-Park Admission,open,groupon,extended,2017-04-30T06:59:59Z,2017-03-17T07:00:00Z,fresno,Fresno,36.7477,-119.772,Amusement Park,Parks,california-s-great-america,California's Great America,https://www.cagreatamerica.com/,,California's Great America,4701 Great America Pkwy,,CA,Santa Clara,Lakewood,95054,US
castle-escape-room,Escape-Room Entry for Two or Four at Castle Escape Room (Up to 40% Off),Up to 40% Off at Castle Escape Room,Escape-Room Entry,open,groupon,extended,2040-07-26T06:59:59Z,2016-03-22T07:00:00Z,san-jose,San Jose,37.3394,-121.895,Gaming,Room Escape Game,castle-escape-room,Castle Escape Room,http://castleescaperoom.com/,180,Castle Escape Room,1967 O'Toole Way,,CA,San Jose,North San Jose,95131,US
smart-destinations-4,Go San Diego Card All-Inclusive 2-Day Pass includes admission to 40+ attractions for 2 days. Pay Nothing at The Gate.,All-Inclusive Pass to San Diego Attractions ,Go San Diego Card,open,groupon,extended,2039-03-23T06:59:59Z,2014-11-17T08:00:00Z,inland-empire,Inland Empire,34.1083,-117.29,Tour - Bus,Tour,smart-destinations,Go City Card,http://smartdestinations.com,30,,,,,,,,
bottle-bottega-sw-san-jose,Two-and-a-Half Hour Painting Party for One or Two from Bottle & Bottega San Jose (Up to 39% Off) ,Up to 39% Off Painting Parties,Painting Party,open,groupon,extended,2039-02-26T07:59:59Z,2014-10-23T07:00:00Z,san-jose,San Jose,37.3394,-121.895,Party,Painting Party,bottle-and-bottega,Bottle & Bottega - SW San Jose,http://bottleandbottega.com/sw-sanjose/,120,Bottle & Bottega - SW San Jose,2125 South Winchester Boulevard,Ste 110,CA,Campbell,Campbell,95008,US
action-whitewater-adventures-19,Half- or Full-Day Rafting Trip with Hot Barbecue Lunch from Action Whitewater Adventures (Up to 50% Off) ,Up to 50% Off Half- or Full-Day Rafting Trip,Rafting Trip Down American River,open,groupon,extended,2017-09-18T06:59:59Z,2016-11-11T08:00:00Z,fresno,Fresno,36.7477,-119.772,Watersports,White Water Rafting (Ride / Activity),action-whitewater-adventures,Action Whitewater Adventures,http://www.actionwhitewater.com/,,Lotus,7149 Hwy 49,,CA,Lotus,Tamaroo Ridge,95651,US
sky-high-sports-santa-clara-7,Two Hours of Jump Time Monday–Thursday at Sky High Sports (Up to 48% Off) ,Up to 48% Off Trampolining ,Trampolining ,open,groupon,extended,2040-10-29T06:59:59Z,2016-06-25T07:00:00Z,san-jose,San Jose,37.3394,-121.895,Trampoline Park,Jumping,sky-high-sports-rancho-cordova,Sky High Sports,http://sjc.jumpskyhigh.com/,90,Sky High Sports Santa Clara,2880 Mead Ave,,CA,Santa Clara,East Murphy,95051,US
goldstar-bal-theatre-35,"""420 Comedy Jam"" - Thursday April 20, 2017 / 7:30pm","""420 Comedy Jam"" - Thursday April 20, 2017 / 7:30pm",Bal Theatre,open,groupon,featured,2017-04-21T02:30:00Z,2017-04-10T16:12:23Z,san-francisco,San Francisco,37.7752,-122.419,Comedy,Stand-up Show,goldstar,Bal Theatre,http://www.baltheatre.com/,,Halcyon-Foothill,14808 East 14th Street,,CA,San Leandro,Halcyon-Foothill,94578,US
dive-high-hanggliding-2,Hang-Gliding Lesson and Flight for One or Two at Dive High (Up to 56% Off),Up to Half Off Hang-Gliding at Dive High,Hang-Gliding for One or Two,open,groupon,extended,2039-03-08T07:59:59Z,2014-11-02T07:00:00Z,san-jose,San Jose,37.3394,-121.895,Paragliding / Hang Gliding (Ride / Experience),Flying,dive-high-hang-gliding,Dive High Hanggliding,http://divehighhanggliding.com/,90,Tracy,25001 Kasson Rd.,,CA,Tracy,Tracy,95304,US
musiclandktv-1,$50 for Two-Hour Karaoke Party Room with Drink Credit at musiclandktv ($110 Value),55% Off Two-Hour Karaoke Party Room at musiclandktv,Two-Hour Karaoke Party Room,open,groupon,extended,2041-02-23T07:59:59Z,2016-10-20T07:00:00Z,san-jose,San Jose,37.3394,-121.895,Caf̩e / Bar Offerings,Karaoke Bar,musiclandktv,musiclandktv,http://www.musiclandktv.com,120,Midtown,788 Barber Lane,,CA,Milpitas,Midtown,95035,US
crawfish-and-catfish-festival,Two or Four Tickets to the Crawfish & Catfish Festival on September 9 or 10 (Up to 52% Off),52% Off Two or Four Tickets to Crawfish & Catfish Festival,Crawfish & Catfish Festival,open,groupon,extended,2017-09-07T06:59:59Z,2017-04-06T07:00:00Z,modesto,Modesto,37.6391,-120.997,Fairs & Festivals,Festival - Food,crawfish-catfish-festival,Crawfish & Catfish Festival,http://www.crawfishandcatfishfestival.com/,,Yolo County Fairgrounds,1250 East Gum Avenue,,CA,Woodland,Northstar,95776,US
gl-heroes-and-villains-8,Heroes & Villains Fan Fest on December 2-3,Heroes & Villains Fan Fest – Up to 31% Off Convention,Heroes & Villains Fan Fest,open,groupon,featured,2017-04-15T06:59:59Z,2017-04-08T07:00:00Z,modesto,Modesto,37.6391,-120.997,Cultural Attractions,Convention,walker-stalker-con-2014-1,Heroes & Villains Fan Fest,https://www.showclix.com/event/HVFFSanJose2017,,San jose Convention Center,150 W San Carlos St.,,CA,San Jose,Downtown San Jose,95113,US
flybayarea-com-2,Intro Flight with Digital Photo for One Pilot and One Optional Passenger from Fly Bay Area (45% Off)  ,45% Off Intro Flight Tour from Fly Bay Area,Flight Experience,open,groupon,extended,2038-11-22T07:59:59Z,2014-07-19T07:00:00Z,san-francisco,San Francisco,37.7752,-122.419,Flying,Airplane (Ride / Experience),fly-bay-area-com,Fly Bay Area,http://www.flybayarea.com/,180,San Carlos,620 Airport Drive,Suite 7,CA,San Carlos,,94070,US
escape-game-911-2,Room Escape Game for Two or Four at Escape Game 911 (Up to 45% Off),Up to 45% Off at Escape Game 911,Room Escape Game,open,groupon,extended,2040-01-29T07:59:59Z,2015-09-25T07:00:00Z,san-jose,San Jose,37.3394,-121.895,Gaming,Room Escape Game,escape-game-911,Escape Game 911,http://escapegame911.com/,180,Winchester,20 Harold Ave,Ste C5,CA,San Jose,Winchester,95050,US
gl-san-jose-improv-8,Standup Comedy Show and Tickets to a Future Comedy Show for Two or Four (Through September 2),San Jose Improv – Up to 80% Off Standup Comedy,Standup Comedy,open,groupon,featured,2017-04-12T06:59:59Z,2017-04-05T07:00:00Z,san-jose,San Jose,37.3394,-121.895,Comedy,Stand-up Show,san-jose-improv,San Jose Improv,http://sanjose.improv.com/,,San Jose Improv,62 South Second Street,,CA,San Jose,Downtown San Jose,95113,US
play-9,"One Play Pass for One Child or Family, or Birthday Party Package at Play! (Up to 30% Off)",Up to 30% Off Play Passes at Play!,Play Passes ,open,groupon,featured,2017-04-13T06:59:59Z,2017-04-09T07:00:00Z,san-jose,San Jose,37.3394,-121.895,Indoor Play Area,Jumping,play-1,Play!,http://www.playlosaltos.com/,120,North Los Altos,170 State Street,,CA,Los Altos,North Los Altos,94022,US
smart-destinations-5-san-francisco, Go San Francisco Card All-Inclusive 2-Day Pass includes admission to 25+ attractions for 2 days. Pay Nothing at Gate. ,All-Inclusive Pass to San Francisco Attractions ,Go San Francisco Card,open,groupon,extended,2039-03-23T06:59:59Z,2014-11-17T08:00:00Z,inland-empire,Inland Empire,34.1083,-117.29,Tour - Bus,Tour,smart-destinations,Go City Card,http://smartdestinations.com,30,,,,,,,,
west-coast-golf-valuebook,"One, Two, or Five ValueBooks with 400+ Discounts & Golf Digest Subscription from West Coast GOLF (Up to 46% Off)",Up to 46% Off ValueBook and Golf Digest from West Coast GOLF,West Coast Golf ValueBook,open,groupon,extended,2041-08-09T06:59:59Z,2017-04-05T07:00:00Z,fresno,Fresno,36.7477,-119.772,Sports & Related,Golf - Recreational,west-coast-golf-value-book,West Coast GOLF ValueBook,http://www.2for1golf.com,120,,,,,,,,
painting-vino-corporate-san-francisco,One 3-Hour Painting Classes at Painting & Vino (Up to 44% Off)  ,Up to 44% Off Painting Class at Painting & Vino,Three-Hour Painting Class,open,groupon,extended,2041-08-10T06:59:59Z,2017-04-06T07:00:00Z,san-francisco,San Francisco,37.7752,-122.419,Courses - Entertainment Media / Arts,Painting Lesson,painting-vino,Painting & Vino - San Fracisco,http://paintingandvino.com/,90,Fiddler's Green of SF,1333 Columbus Ave,,CA,San Francisco,Fishermans Wharf,94133,US
rusty-wallace-racing-experience-stockton-bull-ring,Racing Experience at Rusty Wallace Racing Experience (Up to 60% Off). Three Options Available.,Up to 60% Off Racing Experiences ,Racing Experience,open,groupon,extended,2041-03-24T06:59:59Z,2016-11-18T08:00:00Z,fresno,Fresno,36.7477,-119.772,Driving,High-End / Sport Car (Drive / Experience),drive-tech-racing-1,Rusty Wallace Racing Experience,http://www.racewithrusty.com/,180,Stockton 99 Speedway,4105 N Wilson Way,,CA,Stockton,Pacific,95205,US
superfly-running-inc-149,"Entry for One or Two to The Sugar Rush on May 13, 2017 (Up to 50% Off) ",Up to 50% Off Entry to The Sugar Rush,The Sugar Rush 5K,open,groupon,extended,2017-05-13T06:59:59Z,2017-01-28T08:00:00Z,san-jose,San Jose,37.3394,-121.895,Races & Runs,Marathon - Registration / Participation,superfly-running-inc,The Sugar Rush,http://thesugarrush5k.com/,,San Jose,6099 Winfield Boulevard,,CA,San Jose,Blossom Valley,95120,US
bay-area-glider-rides-1,$165 for a Mile-High Glider Ride at Bay Area Glider Rides ($299 Value),45% Off Glider Ride,Glider Ride,open,groupon,extended,2040-09-03T06:59:59Z,2016-04-29T07:00:00Z,san-jose,San Jose,37.3394,-121.895,Paragliding / Hang Gliding (Ride / Experience),Flying,bay-area-glider-rides,Bay Area Glider Rides,http://www.bayareagliderrides.com,120,Hollister,90 Skylane Dr,Ste 101,CA,Hollister,Hollister,95023,US
kidsportzusa,Two Hours of Sports Play for Up to Two or Four Children at MED-X Sports & Fitness Center (Up to 75% Off) ,Up to 75% Off Sports Play at MED-X Sports & Fitness Center ,Sports Play,open,groupon,extended,2038-07-28T07:00:00Z,2014-03-28T07:00:00Z,san-jose,San Jose,37.3394,-121.895,Indoor Play Area,Jumping,kid-sportz-usa,MED-X Sports & Fitness Center,http://www.fitmedx.com/kidz-club,90,KidSportzUSA,140 N San Tomas Aquino Rd.,Suite 8,CA,Campbell,San Thomas West,95008,US
whitewater-excitement-4,Two Options Available for Gift Cards towards Whitewater Rafting at Whitewater Excitement (Up to 42% Off),Up to 42% Off Gift Cards towards Rafting,Whitewater Rafting,open,groupon,extended,2017-05-11T06:59:59Z,2016-11-13T08:00:00Z,sacramento,Sacramento,38.5816,-121.494,Watersports,White Water Rafting (Ride / Activity),whitewater-excitement-1,Whitewater Excitement,http://whitewaterexcitement.com/,,Tamaroo Ridge,6580 Highway 49,,CA,Lotus,Tamaroo Ridge,95651,US
gl-monster-jam-68,"Monster Jam on Saturday, April 22, at 7 p.m.  ",Monster Jam – Up to 31% Off Monster-Truck Show,Monster-Truck Show,open,groupon,featured,2017-04-19T06:59:59Z,2017-04-08T07:00:00Z,modesto,Modesto,37.6391,-120.997,Family,Monster Trucks,feld-entertainment,Monster Jam,http://www.levisstadium.com/event/2017-04-22-monster-jam/,,Levi's Stadium,4900 Marie P DeBartolo Way,,CA,Santa Clara,Rivermark of Santa Clara,95054,US
heartbeat-ktv,$44 for $90 Towards Karaoke Party Room with $20 Drink Credit at Heartbeat KTV (Up to $110 Value),60% Off Karaoke at Heartbeat KTV,Karaoke Party Room,open,groupon,extended,2041-01-01T08:00:00Z,2016-09-01T07:00:00Z,san-francisco,San Francisco,37.7752,-122.419,Caf̩e / Bar Offerings,Karaoke Bar,heartbeat-ktv,Heartbeat KTV,http://www.heartbeatktv.com,120,Heartbeat KTV,4288 Dublin Boulevard,,CA,Dublin,Pleasanton Meadows,94568,US
faultline-brewing-5-san-francisco,$12 for Two Flights of Five Beers and One Appetizer at Faultline Brewing Company (Up to $26.50 Value),55% Off Beer Flights and Appetizer,Beer Flights,open,groupon,extended,2039-02-04T07:59:59Z,2014-10-01T07:00:00Z,san-francisco,San Francisco,37.7752,-122.419,Restaurant Specialty - Beer Tasting / Flights,Tastings,faultline-brewing,Faultline Brewing,http://www.faultlinebrewing-bayarea.com/,120,Sunnyvale,1235 Oakmead Pkwy.,,CA,Sunnyvale,Sunnyvale,94085,US
gl-official-fan-package-573,San Francisco Giants Game for Two and Optional Signed Memorabilia (April 12–May 26) ,San Francisco Giants – Up to 50% Off Game & Signed Memorabilia,San Francisco Giants (Apr.–May),open,groupon,featured,2017-04-14T06:59:59Z,2017-04-07T07:00:00Z,modesto,Modesto,37.6391,-120.997,Sports,Baseball Game,fhs-entertainment-2,Official Fan Package,http://www.officialfanpackage.com/,,AT&T Park,24 Willie Mays Plaza,,CA,San Francisco,South Beach,94107,US
shaw-academy-1950,Live Online Accredited Certificate in Digital Photography Course from Live Photo Academy (99% Off) ,99% Off Live Online Digital Photography Certification Course,Online Photography Course,open,groupon,extended,2041-06-17T04:00:00Z,2017-02-15T05:00:00Z,abilene,"Abilene, TX",32.4487,-99.7331,Online Photography Course,Courses - eLearning,shaw-academy-9,Live Photo Academy,http://www.livephotoacademy.com/en_GB/course/photography,60,,,,,,,,
gl-monterey-symphony-presents-concert-v-shakespeare-in-music-verdi-and-mahler,Monterey Symphony Presents: Concert V – Shakespeare In Music on April 21 or 22,Monterey Symphony – Up to 60% Off Shakespeare In Music,Monterey Symphony Concert,open,groupon,extended,2017-04-21T06:59:59Z,2017-02-28T08:00:00Z,san-jose,San Jose,37.3394,-121.895,Arts,Orchestra,curtis-chamber-orchestra-at-sunset-center,Monterey Symphony Presents: Concert V - Shakespeare In Music,https://tickets.montereysymphony.org/shows/concert%20v%20-%20shakespeare%20in%20music/events,,Sunset Center,San Carlos St.,,CA,Carmel-by-the-Sea,,93921,US
city-sightseeing-san-francisco-2-5,Hop On/Hop Off Tour for Adults or Children from City Sightseeing (Up to 14% Off). Four Options Available.,Up to 14% Off Hop On/Hop Off Bus Tour,Double-Decker Bus Tour,open,groupon,extended,2041-06-09T06:59:59Z,2017-02-03T08:00:00Z,napa-sonoma,Napa / Sonoma,38.4405,-122.714,Tour - Bus,Tour,city-sightseeing,City Sightseeing San Francisco,http://www.city-sightseeing.us,120,Fishermans Wharf,1331 Columbus Ave,,CA,San Francisco,Fishermans Wharf,94133,US
my-gym-children-s-fitness-center,Lifetime Family Membership with Four Classes and Four Play Sessions at My Gym Children's Fitness Center (64% Off),64% Off at My Gym Children's Fitness Center,Kids' Fitness Membership,open,groupon,extended,2038-02-24T07:59:59Z,2013-10-21T07:00:00Z,san-francisco,San Francisco,37.7752,-122.419,Indoor Play Area,Jumping,my-gym-children-s-fitness-center,My Gym Children's Fitness Center,http://www.my-gym.com/franchisee_schedule.aspx?id=242,120,Midtown,2655 Middlefield Rd,,CA,Palo Alto,Midtown,94306,US
adventure-connection-inc-2-4,"One- or Two-Day Rafting Trip with Lunch or Wine for One or Two from Adventure Connection, Inc (Up to 51% Off)",Up to 51% Off River Rafting Trips,River Rafting Trips,open,groupon,extended,2017-07-02T06:59:59Z,2016-10-19T07:00:00Z,sacramento,Sacramento,38.5816,-121.494,Watersports,White Water Rafting (Ride / Activity),adventure-connection,"Adventure Connection, Inc.",http://www.raftcalifornia.com,,Lotus,6500 CA Hwy 49,,CA,Lotus,Tamaroo Ridge,95613,US
trade-winds-aviation-7,Introductory Flight Lesson in Option of Remos or Cessna 172 Aircraft from Trade Winds Aviation (Up to 61% Off),Up to 61% Off Introductory Flight Lesson,Introductory Flight Lesson,open,groupon,extended,2038-12-11T07:59:59Z,2014-08-07T07:00:00Z,san-jose,San Jose,37.3394,-121.895,Flight Simulator (Ride / Experience),Flying,trade-winds-aviation,Trade Winds Aviation,http://www.tradewindsaviation.com/,90,San Jose,2505 Cunningham Ave.,,CA,San Jose,Alum Rock,95148,US
rockin-jump-fremont-san-jose,"One-Hour Jump Pass for Two, Four, or Six People at Rockin Jump (Up to 52% Off) ",Up to 52% Off Jump Time at Rockin Jump ,Jump Sessions at Trampoline Park,open,groupon,extended,2039-03-28T06:59:59Z,2014-11-22T08:00:00Z,san-jose,San Jose,37.3394,-121.895,Trampoline Park,Jumping,rockin-jump-fremont,Rockin Jump - Fremont,http://fremont.rockinjump.com/,90,Fremont,39177 Farwell Drive,,CA,Fremont,28 Palms,94538,US
gl-i-love-the-90-s-tour-3,"I Love the '90s: The Party Continues with TLC, Biz Markie, and Montell Jordan on Saturday, July 15, at 7 p.m.         ","I Love the 90s w/ TLC, Montell Jordan & More – Up to 52% Off ","TLC, Montell Jordan, Biz Markie",open,groupon,featured,2017-04-28T06:59:59Z,2017-04-07T07:00:00Z,napa-sonoma,Napa / Sonoma,38.4405,-122.714,Hip Hop Music,Music,live-nation-2017,"I Love The 90s: The Party Continues Tour with TLC, Biz Markie, and Montell Jordan",http://concerts1.livenation.com/event/1C00526E009451DE,,Concord Pavilion,2000 Kirker Pass Rd.,,CA,Concord,Clayton,94521,US
gl-official-fan-package-572,SF Giants Game for Two and Optional Memorabilia (May 28–September 19) ,SF Giants – Up to 49% Off Signed Memorabilia & Game ,SF Giants (May–September),open,groupon,featured,2017-04-14T06:59:59Z,2017-04-07T07:00:00Z,modesto,Modesto,37.6391,-120.997,Sports,Baseball Game,fhs-entertainment-2,Official Fan Package,http://www.officialfanpackage.com/,,AT&T Park,24 Willie Mays Plaza,,CA,San Francisco,South Beach,94107,US
goldstar-newark-memorial-high-school-theatre-1,"""Bonnie &amp; Clyde""","""Bonnie &amp; Clyde""",Stage 1 Theatre at Newark Mem...,open,groupon,featured,2017-04-29T03:00:00Z,2017-04-04T21:04:22Z,san-francisco,San Francisco,37.7752,-122.419,Musical,Arts,goldstar,Stage 1 Theatre at Newark Memorial High School,,,Newark,39375 Cedar Boulevard,,CA,Newark,Newark,94560,US
alchemy-assassins-escape-room,"Alchemy and Wizardry Escape Room Experience for Two, Four, or Eight at The 13th Room (Up to 28% Off)",Up to 28% Off Escape Room Experience at Alchemy and Wizardry,Escape Room Experience,open,groupon,extended,2041-06-10T06:59:59Z,2017-02-04T08:00:00Z,inland-empire,Inland Empire,34.1083,-117.29,Gaming,Room Escape Game,the-13th-room,Alchemy and Wizardry Escape Room,http://www.13throom.com,120,Pomona,270 S. Garey ave,,CA,Pomona,Pomona,91766,US
plant-nite-22,Terrarium and Garden-Making Social Event from Plant Nite in Local Bars,44% Off Terrarium & Garden-Making Social Event ,Terrarium & Garden-Making Event,open,groupon,extended,2040-10-18T06:59:59Z,2016-06-14T07:00:00Z,modesto,Modesto,37.6391,-120.997,Gardening / Farming / Beekeeping Education,Courses - Continuing Education,plant-nite,Plant Nite,https://www.plantnite.com/?utm_source=Groupon&utm_medium=Deal&utm_campaign=GreaterSanFrancisco,120,Plant Nite,311 Judah St,,CA,Roseville,Cherry Glen,95678,US
my-gym-children-s-fitness-center-san-carlos,$62 for a Lifetime Family Membership with Classes at My Gym Children's Fitness Center ($160 Value),61% Off at My Gym Children's Fitness Center,Kids' Fitness Membership,open,groupon,extended,2040-01-26T07:59:59Z,2015-09-22T07:00:00Z,san-francisco,San Francisco,37.7752,-122.419,Indoor Play Area,Jumping,my-gym-children-s-fitness-center-san-carlos,My Gym Children's Fitness Center,http://www.mygym.com,120,San Carlos,189 El Camino Real,,CA,San Carlos,San Carlos,94070,US
centre-of-excellence-online-1500,Online Cake-Making Business Diploma Course from Centre of Excellence Online (98% Off),98% Off a Cake-Making Course from Centre of Excellence Online,Cake-Making Business Course,open,groupon,extended,2041-03-10T03:30:00Z,2016-11-08T03:30:00Z,abilene,"Abilene, TX",32.4487,-99.7331,Online Cooking Course,Courses - eLearning,centre-of-excellence-online-1,Centre of Excellence Online,http://www.coe-onlinetrainingcourses.com/a-z-of-courses-c4/cake-making-business-diploma-course-p53,90,,,,,,,,
leadership-academy-summer-camp-4,One-Week Academic Camp for One or Two Children at Leadership Academy (Up to 55% Off),Up to 55% Off Academic Camp at Leadership Academy,Academic Camp,open,groupon,extended,2017-09-01T06:59:59Z,2017-02-19T08:00:00Z,san-jose,San Jose,37.3394,-121.895,Camp - Educational,Camp,leadership-academy-summer-camp,Leadership Academy,http://www.leadershipacademyca.com/,,Rancho Rinconada,18000 Chelmsford Drive,,CA,Cupertino,Rancho Rinconada,95014,US
goldstar-trianon-theatre-9,"Pianist Sofya Gulyak - Sunday May 7, 2017 / 2:00pm","Pianist Sofya Gulyak - Sunday May 7, 2017 / 2:00pm",Trianon Theatre,open,groupon,featured,2017-05-07T21:00:00Z,2017-04-04T15:14:53Z,san-jose,San Jose,37.3394,-121.895,Music,Classical Music,goldstar, Trianon Theatre,http://www.trianontheatre.com/,,Horace Mann,72 North 5th Street,,CA,San Jose,Horace Mann,95112,US
eric-gould-photography-2-san-jose,$42 for a 2.5-Hour Photography Fundamentals Workshop from Eric C. Gould Photography (Up to 72% Off) ,72% Off Photography Workshop,Photography Workshop,open,groupon,extended,2039-09-04T06:59:59Z,2015-05-01T07:00:00Z,san-jose,San Jose,37.3394,-121.895,Courses - Entertainment Media / Arts,Photography Class,eric-c-gould-photography,Eric Gould Photography,http://www.ericgould.com/,90,Heather Farm Park,301 North San Carlos Dr.,,CA,Walnut Creek,Bancroft Village,94598,US
gl-contra-costa-county-fair-san-francisco,$15 for an Unlimited-Ride Wristband or 30 Ride Tickets at Contra Costa County Fair ($30 Value),50% Off Festival Rides at Contra Costa County Fair,Unlimited Fair Rides,open,groupon,featured,2017-04-12T06:59:59Z,2017-04-07T07:00:00Z,napa-sonoma,Napa / Sonoma,38.4405,-122.714,Carnival,Parks,midway-of-fun,Midway of Fun,http://www.midwayoffun.com/,,Contra Costa County Fairgrounds,1201 W 10th St,,CA,Antioch,Brighton Station,94509,US
city-of-cupertino-blackberry-farm-2,Round of Golf for Two or Four or 10-Pass Play Card at Blackberry Farm Golf Course (Up to 48% Off),Up to 48% Off Rounds of Golf at Blackberry Farm Golf Course,Golf,open,groupon,extended,2041-05-04T06:59:59Z,2016-12-29T08:00:00Z,san-francisco,San Francisco,37.7752,-122.419,Sports & Related,Golf - Recreational,city-of-cupertino-blackberry-farm,Blackberry Farm Golf Course,http://www.blackberryfarmgolfcourse.com/,120,Monta Vista,22100 Stevens Creek Blvd.,,CA,Cupertino,Monta Vista,95014,US
goldstar-music-recital-hall-santa-clara-university-2,"Silicon Valley Gay Men's Chorus: ""Oh, The Places You'll Go!""","Silicon Valley Gay Men's Chorus: ""Oh, The Places You'll Go!""","Music Recital Hall, Santa Cla...",open,groupon,featured,2017-04-23T03:00:00Z,2017-04-04T18:58:19Z,san-jose,San Jose,37.3394,-121.895,Arts,Choir,goldstar,"Music Recital Hall, Santa Clara University ",http://www.scu.edu/,,The Old Quad,500 El Camino Real,,CA,Santa Clara,The Old Quad,95053,US
ifly-718270110,$54.99 for One Earn Your Wings 2 Flight Package with Video at iFLY ($69.95 Value)   ,21% Off Earn Your Wings 2 Flight Package with Video at iFLY  ,iFLY Indoor Skydiving,open,groupon,extended,2017-04-26T06:59:59Z,2017-01-29T08:00:00Z,san-francisco,San Francisco,37.7752,-122.419,Flying,Wind Tunnel /Skydiving - Indoor (Ride / Experience),i-fly-sf-bay,iFLY,http://www.iflysfbay.com/,,San Francisco Bay,31310 Alvarado-Niles Road,,CA,Union City,North Fremont,94587,US
adventure-flight-5,30-Minute Classic Aircraft Flights at Adventure Flight (Up to 36% Off). Four Options Available.,Up to 36% Off 30-Minute Classic Aircraft Flights,Classic Aircraft Flights,open,groupon,extended,2041-03-17T06:59:59Z,2016-11-11T08:00:00Z,modesto,Modesto,37.6391,-120.997,Tour - Flying,Tour,adventure-flight,Adventure Flight,http://www.adventureflight.net/,180,Lincoln,1878 Flightline Drive Hangar 2,,CA,Lincoln,,95648,US
gl-2017-reebok-spartan-race-at-t-park-sprint,Entry to the AT&T Park Sprint on November 18 from 2017 Reebok Spartan Races,Up to 23% Off 2017 Reebok Spartan Races,2017 Reebok Spartan Races,open,groupon,extended,2017-11-17T07:59:59Z,2017-02-09T08:00:00Z,napa-sonoma,Napa / Sonoma,38.4405,-122.714,Races & Runs,Race - Mud Run (Activity / Experience),reebok-spartan-races-so-cal,Reebok Spartan Races,https://www.spartan.com/en/race/detail/2608/overview,,AT&T Park,24 Willie Mays Plaza,,CA,San Francisco,South Beach,94107,US
pitching-academy,One or Two 60-Minute Private Pitching Lessons at Pitching Academy (Up to 59% Off),Up to 59% Off Private Pitching Lessons at Pitching Academy,Pitching Lessons,open,groupon,extended,2041-08-06T07:00:00Z,2017-04-06T07:00:00Z,san-diego,San Diego,32.7188,-117.164,Sports & Related,Baseball - Recreational,pitching-academy,Pitching Academy,http://pitchingacademy.com/,90,Belmont ,550 Island Parkway,,CA,Belmont,East Belmont,94002,US
crystal-ballroom-dance-studio-7,5 or 10 Group Dance Lessons for One or Two at Crystal Ballroom Dance Studio (Up to 73% Off),Up to 73% Off Group Dance Lessons for One or Two,Group Dance Lessons,open,groupon,extended,2039-09-24T06:59:59Z,2015-05-21T07:00:00Z,san-jose,San Jose,37.3394,-121.895,Dance Class,Courses - Sports Training,crystal-ballroom-dance-studio,Crystal Ballroom Dance Studio,http://www.crystalbdance.com,120,Santa Clara,3595 Stevens Creek Blvd.,,CA,San Jose,Santa Clara,95117,US
paint-more-events-1,Up to 70% Off Paint Party/Class at Paint & More Events,Up to 70% Off Paint Party/Class at Paint & More Events,Paint Party,open,groupon,extended,2039-09-07T06:59:59Z,2015-05-01T07:00:00Z,san-jose,San Jose,37.3394,-121.895,Party,Painting Party,paint-more-events,Paint & More Events,http://www.paintmorevents.com,120,,,,,,,,
goldstar-various-san-jose-venues-mission-chamber-orchestra,"Mission Chamber Orchestra of San Jose - Sunday April 23, 2017 / 2:30pm (Youthful Adventures)","Mission Chamber Orchestra of San Jose - Sunday April 23, 2017 / 2:3...",Trianon Theatre,open,groupon,featured,2017-04-23T21:30:00Z,2016-05-26T16:59:51Z,san-jose,San Jose,37.3394,-121.895,Orchestra,Arts,goldstar, Trianon Theatre,http://www.trianontheatre.com/,,Horace Mann,72 North 5th Street,,CA,San Jose,Horace Mann,95112,US
